smartctl 7.4 2023-08-01 r5530 [x86_64-linux-6.12.0-211.55.1.el10_2.x86_64_v2] (local build)
Copyright (C) 2002-23, Bruce Allen, Christian Franke, www.smartmontools.org

=== START OF INFORMATION SECTION ===
Model Family:     Seagate Constellation ES.3
Device Model:     ST4000NM0033-9ZM170
Serial Number:    Z1Z9P23Y
LU WWN Device Id: 5 000c50 08724ae9f
Add. Product Id:  DELL(tm)
Firmware Version: GA10
User Capacity:    4,000,787,030,016 bytes [4.00 TB]
Sector Size:      512 bytes logical/physical
Rotation Rate:    7200 rpm
Form Factor:      3.5 inches
Device is:        In smartctl database 7.3/5610
ATA Version is:   ACS-2 (minor revision not indicated)
SATA Version is:  SATA 3.0, 3.0 Gb/s (current: 3.0 Gb/s)
Local Time is:    Sun Sep 20 11:53:50 2026 SAST
SMART support is: Available - device has SMART capability.
SMART support is: Enabled

=== START OF READ SMART DATA SECTION ===
SMART Status not supported: Incomplete response, ATA output registers missing
SMART overall-health self-assessment test result: PASSED
Warning: This result is based on an Attribute check.

General SMART Values:
Offline data collection status:  (0x82)	Offline data collection activity
					was completed without error.
					Auto Offline Data Collection: Enabled.
Self-test execution status:      (   0)	The previous self-test routine completed
					without error or no self-test has ever 
					been run.
Total time to complete Offline 
data collection: 		(   90) seconds.
Offline data collection
capabilities: 			 (0x7b) SMART execute Offline immediate.
					Auto Offline data collection on/off support.
					Suspend Offline collection upon new
					command.
					Offline surface scan supported.
					Self-test supported.
					Conveyance Self-test supported.
					Selective Self-test supported.
SMART capabilities:            (0x0003)	Saves SMART data before entering
					power-saving mode.
					Supports SMART auto save timer.
Error logging capability:        (0x01)	Error logging supported.
					General Purpose Logging supported.
Short self-test routine 
recommended polling time: 	 (   2) minutes.
Extended self-test routine
recommended polling time: 	 ( 482) minutes.
Conveyance self-test routine
recommended polling time: 	 (   3) minutes.
SCT capabilities: 	       (0x50bd)	SCT Status supported.
					SCT Error Recovery Control supported.
					SCT Feature Control supported.
					SCT Data Table supported.

SMART Attributes Data Structure revision number: 10
Vendor Specific SMART Attributes with Thresholds:
ID# ATTRIBUTE_NAME          FLAG     VALUE WORST THRESH TYPE      UPDATED  WHEN_FAILED RAW_VALUE
  1 Raw_Read_Error_Rate     0x010f   076   063   ---    Pre-fail  Always       -       45264243
  3 Spin_Up_Time            0x0103   093   092   ---    Pre-fail  Always       -       0
  4 Start_Stop_Count        0x0032   100   100   ---    Old_age   Always       -       31
  5 Reallocated_Sector_Ct   0x0133   100   100   ---    Pre-fail  Always       -       0
  7 Seek_Error_Rate         0x000f   079   060   ---    Pre-fail  Always       -       86619026
  9 Power_On_Hours          0x0032   061   061   ---    Old_age   Always       -       34238
 10 Spin_Retry_Count        0x0013   100   100   ---    Pre-fail  Always       -       0
 12 Power_Cycle_Count       0x0032   100   100   ---    Old_age   Always       -       30
184 End-to-End_Error        0x0032   100   100   ---    Old_age   Always       -       0
187 Reported_Uncorrect      0x0032   100   100   ---    Old_age   Always       -       0
188 Command_Timeout         0x0032   100   100   ---    Old_age   Always       -       0
189 High_Fly_Writes         0x003a   098   098   ---    Old_age   Always       -       2
190 Airflow_Temperature_Cel 0x0022   075   054   ---    Old_age   Always       -       25 (Min/Max 24/25)
191 G-Sense_Error_Rate      0x0032   100   100   ---    Old_age   Always       -       0
192 Power-Off_Retract_Count 0x0032   100   100   ---    Old_age   Always       -       29
193 Load_Cycle_Count        0x0032   094   094   ---    Old_age   Always       -       12734
194 Temperature_Celsius     0x0022   025   046   ---    Old_age   Always       -       25 (0 23 0 0 0)
195 Hardware_ECC_Recovered  0x001a   039   015   ---    Old_age   Always       -       45264243
196 Reallocated_Event_Count 0x0032   000   000   ---    Old_age   Always       -       65535
197 Current_Pending_Sector  0x0012   100   100   ---    Old_age   Always       -       0
198 Offline_Uncorrectable   0x0010   100   100   ---    Old_age   Offline      -       0
199 UDMA_CRC_Error_Count    0x003e   200   200   ---    Old_age   Always       -       0
240 Head_Flying_Hours       0x0000   100   253   ---    Old_age   Offline      -       33565 (43 125 0)
241 Total_LBAs_Written      0x0000   100   253   ---    Old_age   Offline      -       164483269259
242 Total_LBAs_Read         0x0000   100   253   ---    Old_age   Offline      -       2557656774627

SMART Error Log Version: 1
No Errors Logged

SMART Self-test log structure revision number 1
No self-tests have been logged.  [To run self-tests, use: smartctl -t]

SMART Selective self-test log data structure revision number 1
 SPAN  MIN_LBA  MAX_LBA  CURRENT_TEST_STATUS
    1        0        0  Not_testing
    2        0        0  Not_testing
    3        0        0  Not_testing
    4        0        0  Not_testing
    5        0        0  Not_testing
Selective self-test flags (0x0):
  After scanning selected spans, do NOT read-scan remainder of disk.
If Selective self-test is pending on power-up, resume after 0 minute delay.

The above only provides legacy SMART information - try 'smartctl -x' for more

