smartctl 7.4 2023-08-01 r5530 [x86_64-linux-6.12.0-211.55.1.el10_2.x86_64_v2] (local build)
Copyright (C) 2002-23, Bruce Allen, Christian Franke, www.smartmontools.org

=== START OF INFORMATION SECTION ===
Model Family:     Toshiba 3.5" MG03ACAxxx(Y) Enterprise HDD
Device Model:     TOSHIBA MG03ACA400
Serial Number:    44N1K29MF
LU WWN Device Id: 5 000039 57b701b41
Add. Product Id:  DELL(tm)
Firmware Version: FL1D
User Capacity:    4,000,787,030,016 bytes [4.00 TB]
Sector Size:      512 bytes logical/physical
Rotation Rate:    7200 rpm
Form Factor:      3.5 inches
Device is:        In smartctl database 7.3/5610
ATA Version is:   ATA8-ACS (minor revision not indicated)
SATA Version is:  SATA 3.0, 3.0 Gb/s (current: 3.0 Gb/s)
Local Time is:    Sun Sep 20 12:08:56 2026 SAST
SMART support is: Available - device has SMART capability.
SMART support is: Enabled

=== START OF READ SMART DATA SECTION ===
SMART Status not supported: Incomplete response, ATA output registers missing
SMART overall-health self-assessment test result: PASSED
Warning: This result is based on an Attribute check.

General SMART Values:
Offline data collection status:  (0x82)	Offline data collection activity
					was completed without error.
					Auto Offline Data Collection: Enabled.
Self-test execution status:      (   0)	The previous self-test routine completed
					without error or no self-test has ever 
					been run.
Total time to complete Offline 
data collection: 		(  120) seconds.
Offline data collection
capabilities: 			 (0x5b) SMART execute Offline immediate.
					Auto Offline data collection on/off support.
					Suspend Offline collection upon new
					command.
					Offline surface scan supported.
					Self-test supported.
					No Conveyance Self-test supported.
					Selective Self-test supported.
SMART capabilities:            (0x0003)	Saves SMART data before entering
					power-saving mode.
					Supports SMART auto save timer.
Error logging capability:        (0x01)	Error logging supported.
					General Purpose Logging supported.
Short self-test routine 
recommended polling time: 	 (   2) minutes.
Extended self-test routine
recommended polling time: 	 ( 630) minutes.
SCT capabilities: 	       (0x003d)	SCT Status supported.
					SCT Error Recovery Control supported.
					SCT Feature Control supported.
					SCT Data Table supported.

SMART Attributes Data Structure revision number: 16
Vendor Specific SMART Attributes with Thresholds:
ID# ATTRIBUTE_NAME          FLAG     VALUE WORST THRESH TYPE      UPDATED  WHEN_FAILED RAW_VALUE
  1 Raw_Read_Error_Rate     0x000b   100   100   050    Pre-fail  Always       -       0
  2 Throughput_Performance  0x0004   100   100   000    Old_age   Offline      -       0
  3 Spin_Up_Time            0x0027   100   100   001    Pre-fail  Always       -       11736
  4 Start_Stop_Count        0x0032   100   100   000    Old_age   Always       -       30
  5 Reallocated_Sector_Ct   0x0033   100   100   050    Pre-fail  Always       -       0
  7 Seek_Error_Rate         0x000a   100   100   000    Old_age   Always       -       0
  8 Seek_Time_Performance   0x0004   100   100   000    Old_age   Offline      -       0
  9 Power_On_Hours          0x0032   001   001   000    Old_age   Always       -       44924
 10 Spin_Retry_Count        0x0032   100   100   000    Old_age   Always       -       0
 12 Power_Cycle_Count       0x0032   100   100   000    Old_age   Always       -       30
192 Power-Off_Retract_Count 0x0032   100   100   000    Old_age   Always       -       28
193 Load_Cycle_Count        0x0032   100   100   000    Old_age   Always       -       30
194 Temperature_Celsius     0x0022   100   100   000    Old_age   Always       -       20 (Min/Max 18/35)
196 Reallocated_Event_Count 0x0032   100   100   000    Old_age   Always       -       0
198 Offline_Uncorrectable   0x0030   100   100   000    Old_age   Offline      -       0
199 UDMA_CRC_Error_Count    0x0032   200   253   000    Old_age   Always       -       21
241 Total_LBAs_Written      0x0032   100   100   000    Old_age   Always       -       71465367160
242 Total_LBAs_Read         0x0032   100   100   000    Old_age   Always       -       607597759035

SMART Error Log Version: 1
ATA Error Count: 21 (device log contains only the most recent five errors)
	CR = Command Register [HEX]
	FR = Features Register [HEX]
	SC = Sector Count Register [HEX]
	SN = Sector Number Register [HEX]
	CL = Cylinder Low Register [HEX]
	CH = Cylinder High Register [HEX]
	DH = Device/Head Register [HEX]
	DC = Device Command Register [HEX]
	ER = Error register [HEX]
	ST = Status register [HEX]
Powered_Up_Time is measured from power on, and printed as
DDd+hh:mm:SS.sss where DD=days, hh=hours, mm=minutes,
SS=sec, and sss=millisec. It "wraps" after 49.710 days.

Error 21 occurred at disk power-on lifetime: 39620 hours (1650 days + 20 hours)
  When the command that caused the error occurred, the device was active or idle.

  After command completion occurred, registers were:
  ER ST SC SN CL CH DH
  -- -- -- -- -- -- --
  84 41 00 cf 2c f3 40  Error: ICRC, ABRT at LBA = 0x00f32ccf = 15936719

  Commands leading to the command that caused the error were:
  CR FR SC SN CL CH DH DC   Powered_Up_Time  Command/Feature_Name
  -- -- -- -- -- -- -- --  ----------------  --------------------
  60 00 00 d0 2a f3 40 00  29d+08:22:28.699  READ FPDMA QUEUED
  60 00 00 d0 28 f3 40 00  29d+08:22:28.697  READ FPDMA QUEUED
  60 00 00 d0 26 f3 40 00  29d+08:22:28.696  READ FPDMA QUEUED
  60 00 00 d0 24 f3 40 00  29d+08:22:28.693  READ FPDMA QUEUED
  60 00 00 d0 22 f3 40 00  29d+08:22:28.692  READ FPDMA QUEUED

Error 20 occurred at disk power-on lifetime: 39594 hours (1649 days + 18 hours)
  When the command that caused the error occurred, the device was active or idle.

  After command completion occurred, registers were:
  ER ST SC SN CL CH DH
  -- -- -- -- -- -- --
  84 41 00 47 9f 00 40  Error: ICRC, ABRT at LBA = 0x00009f47 = 40775

  Commands leading to the command that caused the error were:
  CR FR SC SN CL CH DH DC   Powered_Up_Time  Command/Feature_Name
  -- -- -- -- -- -- -- --  ----------------  --------------------
  60 00 00 48 9d 00 40 00  28d+06:16:22.812  READ FPDMA QUEUED
  60 00 00 48 9b 00 40 00  28d+06:16:22.808  READ FPDMA QUEUED
  60 00 00 48 99 00 40 00  28d+06:16:22.806  READ FPDMA QUEUED
  60 00 00 48 97 00 40 00  28d+06:16:22.804  READ FPDMA QUEUED
  60 00 00 48 95 00 40 00  28d+06:16:22.802  READ FPDMA QUEUED

Error 19 occurred at disk power-on lifetime: 39529 hours (1647 days + 1 hours)
  When the command that caused the error occurred, the device was active or idle.

  After command completion occurred, registers were:
  ER ST SC SN CL CH DH
  -- -- -- -- -- -- --
  84 41 00 ef 3a 81 40  Error: ICRC, ABRT at LBA = 0x00813aef = 8469231

  Commands leading to the command that caused the error were:
  CR FR SC SN CL CH DH DC   Powered_Up_Time  Command/Feature_Name
  -- -- -- -- -- -- -- --  ----------------  --------------------
  60 00 00 f0 38 81 40 00  25d+13:07:05.955  READ FPDMA QUEUED
  60 00 00 f0 36 81 40 00  25d+13:07:05.954  READ FPDMA QUEUED
  60 00 00 f0 34 81 40 00  25d+13:07:05.952  READ FPDMA QUEUED
  60 00 00 f0 32 81 40 00  25d+13:07:05.950  READ FPDMA QUEUED
  60 00 00 f0 30 81 40 00  25d+13:07:05.947  READ FPDMA QUEUED

Error 18 occurred at disk power-on lifetime: 39515 hours (1646 days + 11 hours)
  When the command that caused the error occurred, the device was active or idle.

  After command completion occurred, registers were:
  ER ST SC SN CL CH DH
  -- -- -- -- -- -- --
  84 41 00 ef 11 15 40  Error: ICRC, ABRT at LBA = 0x001511ef = 1380847

  Commands leading to the command that caused the error were:
  CR FR SC SN CL CH DH DC   Powered_Up_Time  Command/Feature_Name
  -- -- -- -- -- -- -- --  ----------------  --------------------
  60 00 00 f0 0f 15 40 00  24d+23:37:20.210  READ FPDMA QUEUED
  60 00 00 f0 0d 15 40 00  24d+23:37:20.207  READ FPDMA QUEUED
  60 00 00 f0 0b 15 40 00  24d+23:37:20.205  READ FPDMA QUEUED
  60 00 00 f0 09 15 40 00  24d+23:37:20.203  READ FPDMA QUEUED
  60 00 00 f0 07 15 40 00  24d+23:37:20.202  READ FPDMA QUEUED

Error 17 occurred at disk power-on lifetime: 39511 hours (1646 days + 7 hours)
  When the command that caused the error occurred, the device was active or idle.

  After command completion occurred, registers were:
  ER ST SC SN CL CH DH
  -- -- -- -- -- -- --
  84 41 00 ef ad 01 40  Error: ICRC, ABRT at LBA = 0x0001adef = 110063

  Commands leading to the command that caused the error were:
  CR FR SC SN CL CH DH DC   Powered_Up_Time  Command/Feature_Name
  -- -- -- -- -- -- -- --  ----------------  --------------------
  60 00 00 f0 ab 01 40 00  24d+19:30:26.901  READ FPDMA QUEUED
  60 00 00 f0 a9 01 40 00  24d+19:30:26.899  READ FPDMA QUEUED
  60 00 00 f0 a7 01 40 00  24d+19:30:26.897  READ FPDMA QUEUED
  60 00 00 f0 a5 01 40 00  24d+19:30:26.895  READ FPDMA QUEUED
  60 00 00 f0 a3 01 40 00  24d+19:30:26.894  READ FPDMA QUEUED

SMART Self-test log structure revision number 1
No self-tests have been logged.  [To run self-tests, use: smartctl -t]

SMART Selective self-test log data structure revision number 1
 SPAN  MIN_LBA  MAX_LBA  CURRENT_TEST_STATUS
    1        0        0  Not_testing
    2        0        0  Not_testing
    3        0        0  Not_testing
    4        0        0  Not_testing
    5        0        0  Not_testing
Selective self-test flags (0x0):
  After scanning selected spans, do NOT read-scan remainder of disk.
If Selective self-test is pending on power-up, resume after 0 minute delay.

The above only provides legacy SMART information - try 'smartctl -x' for more

