smartctl 7.4 2023-08-01 r5530 [x86_64-linux-6.12.0-211.55.1.el10_2.x86_64_v2] (local build)
Copyright (C) 2002-23, Bruce Allen, Christian Franke, www.smartmontools.org

=== START OF INFORMATION SECTION ===
Model Family:     Toshiba 3.5" MG03ACAxxx(Y) Enterprise HDD
Device Model:     TOSHIBA MG03ACA400
Serial Number:    X5RHK7Y3F
LU WWN Device Id: 5 000039 69bf02032
Add. Product Id:  DELL(tm)
Firmware Version: FL3D
User Capacity:    4,000,787,030,016 bytes [4.00 TB]
Sector Size:      512 bytes logical/physical
Rotation Rate:    7200 rpm
Form Factor:      3.5 inches
Device is:        In smartctl database 7.3/5610
ATA Version is:   ATA8-ACS (minor revision not indicated)
SATA Version is:  SATA 3.0, 3.0 Gb/s (current: 3.0 Gb/s)
Local Time is:    Sun Sep 20 13:08:26 2026 SAST
SMART support is: Available - device has SMART capability.
SMART support is: Enabled

=== START OF READ SMART DATA SECTION ===
SMART Status not supported: Incomplete response, ATA output registers missing
SMART overall-health self-assessment test result: PASSED
Warning: This result is based on an Attribute check.

General SMART Values:
Offline data collection status:  (0x82)	Offline data collection activity
					was completed without error.
					Auto Offline Data Collection: Enabled.
Self-test execution status:      (   0)	The previous self-test routine completed
					without error or no self-test has ever 
					been run.
Total time to complete Offline 
data collection: 		(   90) seconds.
Offline data collection
capabilities: 			 (0x5b) SMART execute Offline immediate.
					Auto Offline data collection on/off support.
					Suspend Offline collection upon new
					command.
					Offline surface scan supported.
					Self-test supported.
					No Conveyance Self-test supported.
					Selective Self-test supported.
SMART capabilities:            (0x0003)	Saves SMART data before entering
					power-saving mode.
					Supports SMART auto save timer.
Error logging capability:        (0x01)	Error logging supported.
					General Purpose Logging supported.
Short self-test routine 
recommended polling time: 	 (   2) minutes.
Extended self-test routine
recommended polling time: 	 ( 635) minutes.
SCT capabilities: 	       (0x003d)	SCT Status supported.
					SCT Error Recovery Control supported.
					SCT Feature Control supported.
					SCT Data Table supported.

SMART Attributes Data Structure revision number: 16
Vendor Specific SMART Attributes with Thresholds:
ID# ATTRIBUTE_NAME          FLAG     VALUE WORST THRESH TYPE      UPDATED  WHEN_FAILED RAW_VALUE
  1 Raw_Read_Error_Rate     0x000b   100   100   050    Pre-fail  Always       -       0
  2 Throughput_Performance  0x0004   100   100   000    Old_age   Offline      -       0
  3 Spin_Up_Time            0x0027   100   100   001    Pre-fail  Always       -       11539
  4 Start_Stop_Count        0x0032   100   100   000    Old_age   Always       -       11
  5 Reallocated_Sector_Ct   0x0033   100   100   050    Pre-fail  Always       -       0
  7 Seek_Error_Rate         0x000a   100   100   000    Old_age   Always       -       0
  8 Seek_Time_Performance   0x0004   100   100   000    Old_age   Offline      -       0
  9 Power_On_Hours          0x0032   054   054   000    Old_age   Always       -       18627
 10 Spin_Retry_Count        0x0032   100   100   000    Old_age   Always       -       0
 12 Power_Cycle_Count       0x0032   100   100   000    Old_age   Always       -       11
192 Power-Off_Retract_Count 0x0032   100   100   000    Old_age   Always       -       9
193 Load_Cycle_Count        0x0032   100   100   000    Old_age   Always       -       69
194 Temperature_Celsius     0x0022   100   100   000    Old_age   Always       -       19 (Min/Max 18/33)
196 Reallocated_Event_Count 0x0032   100   100   000    Old_age   Always       -       0
198 Offline_Uncorrectable   0x0030   100   100   000    Old_age   Offline      -       0
199 UDMA_CRC_Error_Count    0x0032   200   253   000    Old_age   Always       -       0
241 Total_LBAs_Written      0x0032   100   100   000    Old_age   Always       -       90334658269
242 Total_LBAs_Read         0x0032   100   100   000    Old_age   Always       -       491118697912

SMART Error Log Version: 1
No Errors Logged

SMART Self-test log structure revision number 1
Num  Test_Description    Status                  Remaining  LifeTime(hours)  LBA_of_first_error
# 1  Short offline       Completed without error       00%      7761         -
# 2  Short offline       Aborted by host               60%      7761         -

SMART Selective self-test log data structure revision number 1
 SPAN  MIN_LBA  MAX_LBA  CURRENT_TEST_STATUS
    1        0        0  Not_testing
    2        0        0  Not_testing
    3        0        0  Not_testing
    4        0        0  Not_testing
    5        0        0  Not_testing
Selective self-test flags (0x0):
  After scanning selected spans, do NOT read-scan remainder of disk.
If Selective self-test is pending on power-up, resume after 0 minute delay.

The above only provides legacy SMART information - try 'smartctl -x' for more

